id;created_at;region_id;subscribers_count;name;short_description;address
54;21 Декабрь, 2020;29;1 335;МИЛА 4 АФРИКА;"Благотворительный фонд помощи
социально незащищенным жителям Африки оказывает помощь Людям с альбинизмом; Людям, подвергающимся преследованиям по религиозным и другим соображениям; Людям , оказавшимся в трудной жизненной ситуации; Детям-сиротам и детям из неблагополучных семей; Детям с меланомой и другими заболеваниями; И другим социально незащищенные жителям стран Африки.";"141007,
Московская область,
Г.О. МЫТИЩИ,
Г МЫТИЩИ,
УЛ ХЛЕБОЗАВОДСКАЯ,
Д. 6,
КОМ. 101, ЛИТЕР Д, 1-ЭТАЖ"
63;29 Январь, 2021;5;662;Ника;Благотворительный Фонд помощи бездомным животным «Ника» содержит более 800 животных в двух собственных приютах, организует и выполняет программу «Отлов-стерилизация-вакцинация-выпуск», оказывает срочную ветеринарную помощь бездомным животным, оказывает консультационную и материальную помощь другим приютам.;г. Зеленоград, корпус 322А, 4 этаж, офис 407
64;8 Февраль, 2021;20;68;Мой Байкал;Иркутская Региональная Экологическая Общественная Организация «Мой Байкал» создана в 2016 году, ее цель - сохранять и беречь природу озера Байкал путем активных действий неравнодушных людей.;г. Иркутск
65;10 Февраль, 2021;5;326;Движение-это жизнь;Благотворительный фонд помощи детям с заболеваниями опорно-двигательного аппарата.;г. Москва, ул. П.Андреева, д. 28, к. 3
67;11 Февраль, 2021;22;72;Солнечный Город;"Фонд счастливого детства «Солнечный город» исследует причины социального неблагополучия и внедряет эффективные практики помощи семьям, чтобы каждый ребенок в России жил с любящими родителями. 

Фонд работает в 4-х направлениях:
– профилактика семейного неблагополучия и поддержка семей в сложных жизненных ситуациях; 
– социальная адаптация выпускников детских домов; 
– развитие новых форм семейного устройства, как альтернативы сиротским учреждениям; 
– просвещение общества о важности семьи и счастливого детства в жизни каждого человека. 

В команде фонда работают профессионалы, а за каждым проектом — реальные истории тысяч подопечных, которые получили вашу поддержку.";г. Новосибирск, ул. Гоголя, 15 (7 этаж)
70;26 Март, 2021;24;163;Фонд им. Ани Чижовой;Фонд помогает детям, страдающим неизлечимыми заболеваниями, получить полноценную паллиативную помощь, а также поддерживает их семьи.;428003, Чувашская Республика, г. Чебоксары, ул. Водопроводная, 9/77
71;27 Март, 2021;15;112;Потерь нет;Фонд оказывает системную помощь в решении проблем детей с онкологическими заболеваниями и их семей путем повышения качества и доступности диагностики, лечения детского рака, реабилитации и паллиативной помощи в Республике Башкортостан.;"г. Уфа, ул. Генерала Горбатова, 7/5. Остановка общественного транспорта ""Санаторий Зеленая роща"""
72;7 Апрель, 2021;25;30;Сохрани жизнь;"Благотворительный фонд ""Сохрани жизнь"" помогает Онкогематологическому центру Краевой детской клинической больницы №1 и семьям, где дети болеют онкогематологическими и другими тяжёлыми заболеваниями.";г. Владивосток, пр. Острякова, д. 27
73;9 Апрель, 2021;13;40;Перспективы;«Перспективы» – партнерство благотворительных организаций, работающих ради улучшения жизни детей и взрослых с тяжелой инвалидностью, общественная организация социальной помощи детям-инвалидам и взрослым.;ДЦ Радиус, Волковский пр., 32, Санкт-Петербург
74;14 Апрель, 2021;14;88;Благотворительный фонд МАРИНА;Фонд оказывает помощь детям до 18 лет, оказавшимся в трудной жизненной ситуации, детям - сиротам, детям - инвалидам проживающим в Костромской области.;г. Кострома, ул. Городская, 1А
75;1 Май, 2021;26;355;АНБО «Верность»;АНБО «Верность» более семи лет профессионально и с любовью создаёт спокойную и безопасную жизнь людей и животных в городе, делая новой нормой и естественным образом жизни ответственное отношение к животным.;Ярославская область, город Данилов, ул. Шарохина, 17-32
77;7 Май, 2021;28;33;Социальная платформа;Организация оказывает поддержку людям, попавшим в трудную жизненную ситуацию или нуждающимся в высокотехнологическом лечении из России и стран СНГ.;650023, Кемеровская область - Кузбасс, г.Кемерово, проспект Притомский 35/2, офис 2
78;1 Июнь, 2021;28;251;Только вместе;Фонд помогает детям с особенностями развития и их семьям, развивая системную профессиональную поддержку в образовании и досуге.;Кемеровская область, г. Новокузнецк, пр-кт Энтузиастов д. 7
79;4 Июнь, 2021;13;53;АдВИТА;Фонд помогает детям и взрослым с онкологическими, гематологическими и иммунологическими заболеваниями, которые лечатся в больницах Санкт-Петербурга.;г. Санкт-Петербург, Большой проспект П.С., д. 77, 2 этаж.
80;29 Июнь, 2021;5;406;Ты ему нужен;Фонд помогает детям, приемным детям и сиротам с нейрохирургическими и неврологическими заболеваниями!;г. Тверь, Петербургское шоссе, д.53 А, оф. 611
81;6 Июль, 2021;5;690;Собаки, которые любят;"«Собаки, которые любят» – фонд, который помогает бездомным собакам и кошкам. Организация официально зарегистрирована в апреле 2017 года. Мы оказываем системную поддержку животным в муниципальных и частных приютах: приезжаем в качестве волонтеров, социализируем и выгуливаем, закупаем корма и медикаменты. Опекаем отдельных животных, которые нуждаются в лечении, обеспечиваем их необходимой ветеринарной помощью.

Подать заявку на получение помощи можно, написав на почту info@fund4dogs.ru.";109044, г. Москва, ул. Динамовская, дом 9, строение 1, квартира 84
82;27 Июль, 2021;14;332;География Добра;Благотворительный фонд «География Добра» более 7 лет помогает взрослым и детям в РФ, способствует развитию экологического просвещения, участвует в помощи возрождения памятников архитектуры.;156000, Костромская область, г. Кострома ул. Мясницкая, д. 19 д.
83;29 Июль, 2021;29;1 420;Провидение;Фонд помощи детям и их семьям «Провидение» спасает зрение недоношенным детям и поддерживает их родителей.;г. Москва, Нахимовский проспект, д.30/43
84;9 Август, 2021;30;84;Чужих детей не бывает;Фонд решает проблему социального сиротства.;г. Хабаровск, Кавказская, 35/6
85;10 Август, 2021;31;11;Счастливые Дети;Основная деятельность фонда направлена на устройство детей-сирот в приемные семьи и их сопровождение, а также оказание помощи малышам из домов ребенка, находящимся в больницах города. Фонд работает с детскими домами всего Красноярского края.;г. Красноярск, ул. Молокова, 19, пом. 103
86;13 Август, 2021;32;87;ДоброСвет;"Благотворительный фонд ""ДоброСвет"" помогает детям и молодым взрослым до 35 лет г.Воронежа и Воронежской области с онкологическими и иными тяжелыми заболеваниями.";г.Воронеж, ул. Березовая роща, д.66
87;18 Август, 2021;33;57;Верю в чудо;«Верю в Чудо» содействует детским медицинским и социальным учреждениям, развивает волонтёрство и благотворительность в Калининградской области, помогает повышать компетенции медицинских и социальных работников. С 2013 года центр развивает сферу оказания паллиативной хосписной помощи детям.;г. Калининград, пр. Победы 3
88;19 Август, 2021;5;41;Дари Надежду;Фонд помогает и оказывает разнообразную поддержку одиноким и нуждающимся людям старшего возраста.;г. Москва, ул.Николоямская 26, стр 3, помещение 4
89;27 Август, 2021;34;164;Солнечный день;Фонд помогает одиноким пожилым людям и жителям домов престарелых, инвалидам, семьям воспитывающим детей с ограниченными возможностями здоровья.;г. Челябинск, ул. Марченко 11б
90;15 Сентябрь, 2021;2;330;СОЗИДАНИЕ;Автономная Некоммерческая Организация «СОЗИДАНИЕ» ведет свою деятельность в экологической сфере. Проект «Сады Поколений» - сажаем деревья в общественных пространствах, береговой линии и в социальных учреждениях. Проект «Родники Ингушетии» - благоустройство родников. Проект «Читай» - просветительская деятельность по насущным проблемам.  Ключевая задача – это озеленение Сунженского хребта для предупреждения опустынивания.;г. Назрань
91;3 Октябрь, 2021;35;30;Преодоление;Наша миссия - помогать одиноким пожилым людям жить. Мы хотим обеспечить главное право человека - право на достойную старость.;г. Тамбов, ул. Красная, 1
94;18 Январь, 2022;1;343;Тлондода;"БФ «Тлондода» — фонд помощи, организованный выходцами села Тлондода для оказания помощи и поддержки сельчан. 
Основные направления:
1. Помощь людям, оказавшимся в тяжелой жизненной ситуации
2. Помощь больным
3. Образование
4. Улучшение сельской инфраструктуры";Цумадинский район, с. Тлондода, ул. им.Магомеда Шамхалова, д. 76
95;19 Январь, 2022;5;341;Дорога жизни;Фонд «Дорога Жизни» с 2016 года помогает детям-сиротам из регионов обрести полноценную жизнь. Мы организуем доступ к качественной медицине, чтобы наши подопечные могли развиваться, учиться и расти счастливыми.  Мы объединяем учреждения, государственные ведомства и медицинские организации, чтобы улучшить жизнь детей, оставшихся без семьи.  Фонд также предоставляет больничных нянь детям, попавшим в трудную жизненную ситуацию: изъятым из асоциальных семей, потерявшимся в городе, оставшимся без родителей.;111141, Москва, Кусковская улица, 20А, БЦ «Кусково», подъезд 5, офис 605А
96;25 Январь, 2022;5;40;Подарок Ангелу;С 2014 года благотворительный фонд помощи детям и взрослым «Подарок Ангелу» занимается системной помощью неполным и малоимущим семьям, в которых воспитываются дети с церебральным параличом и другими нарушениями опорно-двигательного аппарата, оказывая помощь по различным направлениям: постоянная комплексная реабилитация, материальная адресная помощь, социализация и психологическая поддержка.;г. Москва, ул. Кожевническая, дом 1, стр 1, этаж 6, офис №601
97;23 Февраль, 2022;15;57;Ломая Барьеры;Помогаем детям с ограниченными возможностями здоровья!;РБ, г.Уфа, ул. Менделеева 195\2, кв. 121
98;12 Март, 2022;5;141;Вера;Фонд «Вера» был основан в 2006 г. Это некоммерческая организация, которая системно занимается паллиативной помощью, поддержкой хосписов и их пациентов, оказывает услуги сопровождения паллиативных пациентов на дому.;Москва, 2-й Николощеповский переулок, дом 4
99;30 Март, 2022;5;117;Фонд борьбы с инсультом ОРБИ;Фонд борьбы с инсультом ОРБИ – первая профильная организация, которая занимается проблемой инсульта в России. Был основан в 2010 году. Сегодня фонд ОРБИ помогает людям после инсульта, а также их семьям, поддерживает медицинские учреждения, проводит курсы повышения квалификации для медицинского персонала, строит по всей России специальные пространства для реабилитации после инсульта – эргокомнаты, закупает необходимое медицинское оборудование, проводит масштабные информационные кампании по профилактике инсульта.;г. Москва, ул. Студенческая 32
100;28 Апрель, 2022;5;305;ПОДСОЛНУХ;"Благотворительный Фонд помощи детям и взрослым с нарушениями иммунитета  «ПОДСОЛНУХ» - первая и единственная в Росси некоммерческая организация, которая с 2006 года занимается системной помощью детям и взрослым с тяжелыми врожденными нарушениями иммунитета.
 
Миссия фонда – находить пациентов с врожденными заболеваниями иммунитета и помогать им жить полноценной жизнью.";г. Москва, ул. Бутлерова, д. 17, БЦ Neo Geo, этаж 3, ком. 269
101;17 Май, 2022;5;204;Найди семью;"Фонд “Найди семью” работает, чтобы приемные дети справились с травмами сиротского прошлого и никогда не возвращались в детские дома.

Чтобы помочь приемным семьям преодолеть трудности, мы оказываем комплексную помощь: с детьми и родителями работают психологи и другие помогающие специалисты. Семьи с приемными детьми могут получить помощь очно в Москве и регионах и онлайн по всей России.

Мы также оказываем адресную помощь на лечение и реабилитацию приемных детей, а также на оплату поездок приемных родителей за детьми в отдаленные регионы России и готовим кандидатов в приемные родители к осознанному решению.

Если вы приемный родитель или готовитесь им стать, и вам нужна помощь, вы можете написать нам на почту info@sirota.ru.";г. Москва, ул. Садовая-Кудринская, д. 32А стр. 9, 4 этаж, офис 41, 44.
102;17 Май, 2022;31;438;Жёлтый Аист;Помогаем детям в трудной жизненной ситуации и создаём возможности для их счастливого будущего с учетом индивидуальных возможностей каждого ребёнка.;652300, Красноярский край, г. Сосновоборск, улица Юности, д. 3, помещение 240, ком.8
103;20 Май, 2022;13;31;Мусора.Больше.Нет;Общественная экологическая организация России. Более 18 лет занимается просвещением детей и взрослых по темам переработки, сбережения ресурсов, сокращения отходов. Активисты проводят уроки, лекции, викторины, квесты, выставки, курсы, квизы, акции.;Юридический Адрес: г. Санкт-Петербург, ул. Кржижановского, д. 3, корпус 3
104;23 Май, 2022;5;264;Жизнь;Благотворительный фонд «Жизнь» помогает детям с онкологическими и онкогематологическими заболеваниями в оплате лечения, обследований и покупке лекарств.;г. Москва, Алтуфьевское шоссе, д. 27, 3 этаж, офис 323.
105;26 Май, 2022;5;58;Арифметика Добра;"Благотворительный фонд «Арифметика добра» был учрежден для системного решения проблемы сиротства в России в 2014 году.  
Миссия фонда – помочь детям-сиротам найти семью и стать успешными членами общества. 
Мы убеждены, что каждый ребенок имеет право найти свою семью, определить собственные возможности и сделать самостоятельный выбор.
Приоритетными направлениями работы фонда «Арифметика добра» являются поддержка усыновления и семейного устройства воспитанников детских домов, формирование института профессиональных приемных родителей, подготовка семей к принятию подростков, а также социализация и адаптация детей-сирот, организация дистанционного обучения, профориентация и формирование социальных навыков у воспитанников детских домов, постинтернатное сопровождение, подготовка и создание пары наставника и воспитанника.";Москва, 1-й Кожевнический переулок 6, строение 1, 1 этаж, помещение 13а.
107;3 Июнь, 2022;5;37;Живи сейчас;"Боковой амиотрофический склероз (БАС), который чаще называют «болезнью Стивена Хокинга» или «болезнью Лу Геринга», поражает двигательные нейроны. Из-за этого у людей, которые столкнулись с этим заболеванием, постепенно перестают работать мышцы, и теряется возможность самостоятельно двигаться, говорить, глотать, дышать.

В России, где с БАС живут 15 тысяч человек, единственной некоммерческой организацией, поддерживающей развитие системной помощи пациентам с БАС, является Благотворительный фонд «Живи сейчас».";"Юридический и почтовый адрес: 
117246, Москва, ул. Херсонская, 41—10


Адрес офиса: 
Москва, ул. Нижегородская, д. 32, стр. 4, офис 117"
110;25 Июль, 2022;13;274;Умка;Санкт-Петербургская благотворительная общественная организация помощи детям-инвалидам «Умка» работает с 2003 года, оказывая помощь маленьким пациентам онкологических отделений больниц, детям-инвалидам и их семьям, воспитанникам коррекционных детских домов и школ-интернатов.;197183, г. Санкт-Петербург, Карельский переулок, д. 3, пом.4-Н
