id;created_at;region_id;subscribers_count;name;short_description;address
146;8 Сентябрь, 2023;5;92;Второе дыхание;"Фонд «Второе дыхание» собирает и передаёт одежду людям, которым она нужна, с 2015 года. За это время более 272 000 человек из 31 региона получили помощь, и более 5000 тонн одежды нашли новых хозяев или были переработаны.

Одежду от Фонда получают многодетные и малоимущие семьи, пенсионеры, люди с ограниченными возможностями здоровья, мигранты, бездомные и другие люди в сложной жизненной ситуации. Часть вещей мы направляем в приюты для животных на подстилки. Одежду в плохом состоянии мы направляем на переработку. 

Мы устанавливаем контейнеры, чтобы каждый житель города мог экологично избавиться от одежды, которая ему больше не нужна. Все вещи поступают в Центр сортировки Фонда, их мы сортируем вручную, чтобы определить, можно ли передать её людям и носить дальше, или нужно переработать.

Так одежда становится ресурсом, который помогает людям справляться с экономическими и социальными проблемами, повышает их чувство собственного достоинства и позволяет чувствовать себя более уверенно.";Российская Федерация, 129085 г. Москва, ул. Годовикова, д. 6, этаж 1, помещение IIА, VII, комнаты 1-7, 7А, 8, 9/1-6, 6А, 7
147;27 Сентябрь, 2023;13;7;Инклюзивный центр «Йом-йом»;«Йом-йом» - это детский центр в Санкт-Петербурге, который занимается включением детей с особенностям развития в среду сверстников, помогает построить инклюзивную среду в садах и школах, делает истории детей с особенностями развития видимыми и яркими.;190000, г. Санкт-Петербург, ул. Маяковского, д. 42, литера А, пом. 9-Н.
150;7 Февраль, 2024;26;16;Дом милосердия кузнеца Лобова;"Дом милосердия кузнеца Лобова с 2018 года оказывает медико-социальную (паллиативную) помощь тяжелобольным взрослым в Ярославской области.  Работаем по программе «Отделение милосердия» — это небольшой хоспис на 20 мест, что расположился в старинной купеческой усадьбе поселка Поречье – Рыбное.  В 2020 году запустили программу «Хоспис на дому». Помощь направлена на семьи с тяжелобольным взрослым в Ярославской области, преимущественно проживающим в сельской местности. 

Ежегодно более 200 тяжелобольных человек получают комплексную поддержку команды Дома Лобова. Мы снимаем болевые симптомы, оказываем комплексную поддержку больному человеку и его семье, сохраняя семейные ценности и родственные связи. А если вдруг семьи нет, то стенами родного дома становится сам Дом милосердия.  Стремимся к цели, чтобы пожилые, тяжелобольные и одинокие люди, а также люди, утратившие способность к самообслуживанию, имели возможность получать бесплатную, качественную и профессиональную помощь 24/7. 

В результате работы  Дома Лобова в 2023 году 460 семей с тяжелобольным взрослым получили психологическую и социальную поддержку. Осуществлено 1829 патронажей.  Выдано 162 медицинских изделия по договору безвозмездного пользования. А еще патронажный автомобиль хосписа осуществил 355  перевозок тяжелобольных подопечных в медицинские учреждения.";Ярославская область, Ростовский р-н, рп. Поречье-Рыбное, ул. Кирова, д. 53
151;21 Февраль, 2024;17;93;Добро Рядом;Объединение людей с активной гражданской позицией для реализации социально-значимых программ в сфере образования, здравоохранения и спорта.;420043, Республика  Татарстан, г. Казань, ул. Вишневского, д.22,  кв. 28
154;19 Апрель, 2024;21;8;Сохраняя жизнь;"Фонд «Сохраняя жизнь» с 2008 года  оказывает помощь детям, оставшимся без попечения родителей, усыновителям и опекунам, детям пережившим насилие.

Главным направлением помощи фонда является помощь детям в детских домах, помощь усыновителям и детям в приемных семьях, профилактика социального сиротства. Также фондом развивается программа фонда по реабилитации детей, переживших насилие или тяжелую психологическую травму. 

Помощь детям в детских домах трансформируется в программу наставничества. 

Также фонд занимается развитием волонтерского движения в Оренбургской области.";г. Оренбург, ул. Орджоникидзе, 20.
156;20 Июнь, 2024;5;9;Дети наши;"С 2006 года благотворительный фонд ""Дети наши""  работает над решением проблемы сиротства в России. 
Основными целями фонда являются: 1) поддержка кризисных семей с целью предотвращения попадания детей в детские дома и их возвращения в них, 2) оказание поддержки детям, оставшимся без попечения родителей, 3) социализация детей из детских домов, 4) оказание помощи и поддержки выпускникам детских домов.";Москва, Дербеневская наб., 7с13
157;20 Июнь, 2024;5;3;Детские деревни SOS;Благотворительная организация «Детские деревни SOS» помогает детям и их родителям с 1994 года в 12 регионах России.  Основными направлениями нашей работы являются поддержка семей, попавших в кризисную ситуацию, в которых дети могут лишиться родительской опеки, помощь детям-сиротам и детям, оставшимся без попечения родителей, а также сопровождение молодых людей из различных форм опеки, вступающих в самостоятельную жизнь. Мы убеждены, что каждый ребёнок должен расти в любящей семье в атмосфере доверия, заботы, уважения и безопасности. За 30 лет работы более 28 000 детей нам удалось уберечь от социального сиротства. Эти дети не лишились заботы кровных родителей, обрели любящую семью и чувство защищённости. Вместе с приёмными родителями из шести Детских деревень SOS мы подготовили и выпустили в самостоятельную взрослую жизнь более 500 ребят, помогли им преодолеть травмы детства и реализовать свои потребности. Всю профессиональную помощь семьям и детям наши специалисты оказывают безвозмездно благодаря поддержке таких же неравнодушных людей, как и вы.;117292, Москва, ул. Кедрова, д. 5, стр. 1, офис 5
